{"html":"<h2>DEMO section</h2><p>This is <strong>demo</strong> article text for <em>DEMO article one: reading the demo forecast</em>. It contains no real statistics.</p><ul><li>DEMO point one</li><li>DEMO point two</li></ul><p><a href=\"../demo-article-one/\">Related DEMO article</a></p><table><caption>DEMO table</caption><thead><tr><th scope=\"col\">Label</th><th scope=\"col\">Value</th></tr></thead><tbody><tr><td>DEMO</td><td>1</td></tr></tbody></table>","provenance":"DEMO: generated by web/scripts/make-demo-fixture.mjs","sources":[{"label":"DEMO fixture generator","note":"DEMO data: synthetic values for interface testing only; not AFL statistics.","url":null}],"summary":{"as_of":"DEMO as of 2026-09-20","category":"analysis","editorial_state":"published_archive","excerpt":"DEMO excerpt for DEMO article one: reading the demo forecast.","original_path":"docs/demo/demo-article-one.md","published":"2026-09-20","resource":"articles/demo-article-one.json","scope":"frozen","slug":"demo-article-one","title":"DEMO article one: reading the demo forecast"}}
